name,code,demand_name,demand_code,cm_code,enterprise_code,cooperate,synopsis,technology,research,remark
高品质长效高端电子试剂包材的开发研究,220304BCNMDGFZHH,高品质长效高端电子试剂包材的开发,21123182CT1GGPDP,2201136T987HX400,220106CGGKSKTB9P,合作开发,包材材料抗强酸强碱强氧化等浸泡实验及物理化学测试 将通过包材在高纯度试剂中的浸泡实验来研究常见包材材料的机械性能和热稳定性能，定量的掌握试剂和包材的相互影响规律，以及探索延长包材寿命的方法,高纯试剂和包材相互影响规律及检测标准； 通过浸泡实验和先进的物理化学分析，来研究高纯试剂和包材的相互影响规律；研究包材材料在不同的试剂中的使用寿命，制定相应的标准和建立可靠的数据库,委托单位有着雄厚的科研基础和世界顶尖的实验测试装备和设备,无
重症护理机器人,2203047H94AYM23C,重症护理机器人,220111B0F71Y4RWH,2201146H5M330DAW,220127B0RHF1CYRP,合作开发,我们设计了一种可以协助医护人员救治重症病人的护理机器人，可以协助医务人员采集病人的生命体征，协助拍背和翻身，并可代替医务人员与病人进行简单的交流等,完成样品制作，申请发明专利两项，实用新型专利一项,已完成俯卧位重症监护病床的研究，可以轻松协助重病病人仰卧位和俯卧位体位变换,无
人参及其他系列康养产品开发项目,2203047FFWHM47F8,中医药系列康养产品开发项目,220304AS4K6RCXD4,220126791KZNNF80,220221B5N2X9KTXP,合作开发,我们的研发创新之处在于，以中医药基础理论为指导，以人参的临床应用情况为参考，结合适用人群的具体体质情况，以多年的实验研究结果为基础，以药食同源的人参为主导，组成4个不同的配方，结合现代药理实验方法，采用液体配比和配方颗粒的不同产品形式，有针对性的开发系列产品。,1、提供一批新产品 2、形成一份技术报告 3、发表科技论文 4、培养本硕人才,相关国家级和省级基础课题已经完成，发表论文6篇，其中 SCI 3篇，核心2篇。,无
陶卫、食品行业综合MES系统方案,220301A96ZT8F6A8,实验平台信息化技术开发项目,220304BWPKWT1RYW,2202116S3H30BNTC,220221CRZ5SB5GR4,"委托研究
合作开发",本方案通过开发示范线配套的MES系统，结合 5G 技术、VR 技术、AGV 技术以及大屏相关技术，有效的演示了从接单、计划、布产、生产、流程控制直到产品质检入库、包装出货的制造业全流程信息化,1、通过对基础数据的录入和生产资源的管理，对产线进行信息化建模； 2、在产线数据采集和数据录入的基础上，对数据进行可视化呈现,1、产线生产资源数字化建模； 2、VR 技术在陶卫、食品生产中的应用； 3、云计算与边缘计算在陶卫、食品生产中的应用,本方案采用最新的互联网全栈框架（MEAN），充分演示了“互联网+”或“+互联网”技术在制造业的应用。
利用生物絮团技术构建节水环保型对虾高位池养殖,220302C2MTYRGNTC,对虾高位池养殖水质调控与尾水净化技术工艺升级改造,220301BZ2K4C19WH,220304ACFY1WWB2W,220304AP0841SY80,合作开发,在对虾高位池养殖过程中采用生物絮团技术，即通过增氧设施优化、水体营养平衡、功能菌剂诱导等措施，原位调控和维护良好水质，在养殖前期不换水，养殖中后期定期排放少量池水,与传统集约化水泥池或高位池相比，对虾养殖存活率和单位产量有了明显提高，单位产值能耗降低了10%以上，养殖排放水减少了80%以上，综合经济效益提升了20%以上,前期已突破了对虾集约化养殖全程零换水的技术瓶颈，优化和改进了工程化养殖池结构布局和增氧设施，应用和提升了生物絮团原位调控水质技术，形成了对虾工程化零换水养殖增效技术体系和应用方案,无
